ID,Project,Website,Collection,Product,Short_Name,Description,Access,Notebook,Format,Category,Start,End,Region,Coordinate,Spatial Resolution,Temporal Resolution,Released,Polygon,Variables,DOI,Theme1,Theme2,Theme3,EO_Missions,Consortium
0,4dHydro,https://4dhydro.eu/,geoframe 30 arc-seconds  discharge (ground meas) for Po,geoframe_q_ 30 arc-seconds (measurements) for Po (2015 - 2018),geoframe_gauge_q_po_30sec_daily_20151001_20180930.nc,simulated river discharge by geoframe using ground measured data as the input variables for the sub-region of Po over 2015-2018,https://zenodo.org/records/10641131/files/geoframe_gauge_q_po_30sec_daily_20151001_20180930.nc,,NetCDF,,1-10-2015,30-09-2018,po,WGS84,30 arc-seconds,daily,23-10-2023,"[[[6,43],[13,43],[13,47],[6,47],[6,43]]]",discharge,https://doi.org/10.5281/zenodo.10641131,land,,,,UTN
1,4dHydro,https://4dhydro.eu/,geoframe 30 arc-seconds  soil moisture (ground meas) for Po,geoframe_sm_ 30 arc-seconds (measurements) for Po (2015 - 2018),geoframe_gauge_sm_po_30sec_daily_20151001_20180930.nc,simulated soil moisture by geoframe using ground measured data as the input variables for the sub-region of Po over 2015-2018,https://zenodo.org/records/10641131/files/geoframe_gauge_sm_po_30sec_daily_20151001_20180930.nc,,NetCDF,,1-10-2015,30-09-2018,po,WGS84,30 arc-seconds,daily,23-10-2023,"[[[6,43],[13,43],[13,47],[6,47],[6,43]]]",soil moisture,https://doi.org/10.5281/zenodo.10641131,land,,,,UTN
2,4dHydro,https://4dhydro.eu/,geoframe 30 arc-seconds  evapotranspiration (ground meas) for Po,geoframe_et_ 30 arc-seconds (measurements) for Po (2015 - 2018),geoframe_gauge_et_po_30sec_daily_20151001_20180930.nc,simulated evapotranspiration by geoframe using ground measured data as the input variables  for the sub-region of Po over 2015-2018,https://zenodo.org/records/10641131/files/geoframe_gauge_et_po_30sec_daily_20151001_20180930.nc,,NetCDF,,1-10-2015,30-09-2018,po,WGS84,30 arc-seconds,daily,23-10-2023,"[[[6,43],[13,43],[13,47],[6,47],[6,43]]]",evapotranspiration,https://doi.org/10.5281/zenodo.10641131,land,,,,UTN
4,4dHydro,https://4dhydro.eu/,geoframe 30 arc-seconds  total water storage (ground meas) for Po,geoframe_tws_ 30 arc-seconds (measurements) for Po (2015 - 2018),geoframe_gauge_tws_po_30sec_daily_20151001_20180930.nc,simulated total water storage by geoframe using ground measured data as the input variables  for the sub-region of Po over 2015-2018,https://zenodo.org/records/10641131/files/geoframe_gauge_tws_po_30sec_daily_20151001_20180930.nc,,NetCDF,,1-10-2015,30-09-2018,po,WGS84,30 arc-seconds,daily,24-8-2023,"[[[6,43],[13,43],[13,47],[6,47],[6,43]]]",total water storage,https://doi.org/10.5281/zenodo.10641131,land,,,,UTN
5,4dHydro,https://4dhydro.eu/,geoframe 30 arc-seconds upstream area for Po,geoframe_gauge_uparea_po_30arcsec,geoframe_gauge_uparea_po_30sec.nc,upstream area for teh sub-region of Po river basin (Aosta Valley),https://zenodo.org/records/10641131/files/geoframe_gauge_uparea_po_30sec.nc,,NetCDF,,1-10-2015,30-09-2018,po,WGS84,30 arc-seconds,daily,23-10-2023,"[[[6,43],[13,43],[13,47],[6,47],[6,43]]]",upstream area,https://doi.org/10.5281/zenodo.10641131,land,,,,UTN
6,4dHydro,https://4dhydro.eu/,geoframe 30 arc-seconds mask for Po,geoframe_gauge_mask_po_30arcsec,geoframe_gauge_mask_po_30sec.nc,mask for sub region of Po river basin (Aosta Vally),https://zenodo.org/records/10641131/files/geoframe_gauge_mask_po_30sec.nc,,NetCDF,,1-10-2015,30-09-2018,po,WGS84,30 arc-seconds,daily,23-10-2023,"[[[6,43],[13,43],[13,47],[6,47],[6,43]]]",mask,https://doi.org/10.5281/zenodo.10641131,land,,,,UTN
,,,,,,,,,,,,,,,,,,,,,,,,,
